,Salary Estimate,Founded,Company Name,Job Title,Job Description,Rating,Revenue,Sector,Size,Industry,Type of Ownership,Location
0,Employer Provided Salary:$29 - $34 Per Hour,,Nova Collective,Data Analyst,"Are you a data analyst who is really excited about finding new ways to quantify, qualify, and present data about diversity, equity, and inclusion in top organizations?
Can you speak to the perils and pitfalls of data analysis in human sciences - especially as it relates to DEI?
Are you extremely detail-oriented and methodical in your approach - not someone who rushes to find a shortcut and loses the benefits of outlying or unusual data?
Are you prepared and excited to help build out our data capabilities in Qualtrics?
Interested in a part-time (10-30 hours a week), flexible, remote role?
Do you bring a strong background in survey data principles, such as:
Working with raw survey data to produce clean data sets for analysis and reporting",,,,,,,"Chicago, IL"
1,Employer Provided Salary:$29 - $34 Per Hour,,CBL Solutions,Data Science - Entry Level,"Are you a data analyst who is really excited about finding new ways to quantify, qualify, and present data about diversity, equity, and inclusion in top organizations?
Can you speak to the perils and pitfalls of data analysis in human sciences - especially as it relates to DEI?
Are you extremely detail-oriented and methodical in your approach - not someone who rushes to find a shortcut and loses the benefits of outlying or unusual data?
Are you prepared and excited to help build out our data capabilities in Qualtrics?
Interested in a part-time (10-30 hours a week), flexible, remote role?
Do you bring a strong background in survey data principles, such as:
Working with raw survey data to produce clean data sets for analysis and reporting",,,,,,,"Lawrenceville, NJ"
2,Employer Provided Salary:$60K,Company - Private,PCS Global Tech,Data Science Opportunities/ Entry Level for Recent Graduates STEM,,4.5,,Unknown / Non-Applicable,501 to 1000 Employees,Information Technology,IT Services,"Irvine, CA"
3,Employer Provided Salary:$60K,Company - Private,RMDS Lab,Data Scientist for GRMDS.org,"Responsibilities:
· Provides plan with data, reporting and analyses that enable data driven decision making.
· Provides summary analyses in written and oral presentation settings.
· Builds database from scratch. And prepares complex presentations.
· Develops system test cases and documents results, researches system issues and documents findings.
Requirements:
· Bachelor’s degree in Science, Technology, Engineering or Mathematics
· Ability to translate business requirements into non-technical, lay terms",4.5,,Unknown / Non-Applicable,501 to 1000 Employees,Information Technology,IT Services,"Pasadena, CA"
4,Employer Provided Salary:$56K - $118K,,Titan America,Junior Data Scientist,"We are looking for a Data Scientist to analyze large amounts of raw information to find patterns and insights that will help our company and our clients. We will rely on you to build data products to extract valuable business insights. In this role, you should be highly analytical with a knack for analysis, math and statistics. Critical thinking and problem-solving skills are essential for interpreting data. We want to see a passion for machine-learning and research. Your goal will be to help our company and our clients analyze trends to make better decisions.
Responsibilities
Identify valuable data sources and automate collection processes
Undertake preprocessing of structured and unstructured data
Analyze large amounts of information to discover trends and patterns",,,,,,,"Roanoke, VA"
5,,1902,Toyota Connected North America,Entry Level Data Scientist,"We are looking for a Data Scientist to analyze large amounts of raw information to find patterns and insights that will help our company and our clients. We will rely on you to build data products to extract valuable business insights. In this role, you should be highly analytical with a knack for analysis, math and statistics. Critical thinking and problem-solving skills are essential for interpreting data. We want to see a passion for machine-learning and research. Your goal will be to help our company and our clients analyze trends to make better decisions.
Responsibilities
Identify valuable data sources and automate collection processes
Undertake preprocessing of structured and unstructured data
Analyze large amounts of information to discover trends and patterns",4.4,Unknown / Non-Applicable,Information Technology,1001 to 5000 Employees,IT Services,Company - Private,"Plano, TX"
6,,2016,Capgemini,Entry Level Data Engineer - September Start Date,"Toyota Connected's Mobility team is responsible for building and managing our connected vehicle platforms, supporting product research using vehicle sensor data and creating new and exciting data services for Toyota customers that makes driving safer, more convenient, and fun. We're looking for an Entry Level Data Scientist interested in using data science and statistical techniques to create state-of-the-art solutions for non-trivial, and arguably, unsolved problems. If you are results driven, interested in how to apply advanced Data Science techniques, would love to work with vehicle telemetry data and video, are highly innovative and long for the opportunity to build solutions for challenging problems that directly impact the company's bottom-line, we want to talk to you.
What will you be doing?
You will have the opportunity to work in a fast-paced Agile Scrum environment to assist in prototyping, designing, and implementing predictive models and algorithms to create real world solutions",3.3,Unknown / Non-Applicable,Information Technology,51 to 200 Employees,IT Services,Company - Private,"New York, NY"
7,,2016,Dataspace,110: Head of Data Science,"Toyota Connected's Mobility team is responsible for building and managing our connected vehicle platforms, supporting product research using vehicle sensor data and creating new and exciting data services for Toyota customers that makes driving safer, more convenient, and fun. We're looking for an Entry Level Data Scientist interested in using data science and statistical techniques to create state-of-the-art solutions for non-trivial, and arguably, unsolved problems. If you are results driven, interested in how to apply advanced Data Science techniques, would love to work with vehicle telemetry data and video, are highly innovative and long for the opportunity to build solutions for challenging problems that directly impact the company's bottom-line, we want to talk to you.
What will you be doing?
You will have the opportunity to work in a fast-paced Agile Scrum environment to assist in prototyping, designing, and implementing predictive models and algorithms to create real world solutions",3.3,Unknown / Non-Applicable,Information Technology,51 to 200 Employees,IT Services,Company - Private,"New York, NY"
8,,1967,First Soft Solutions [ Direct],Azure Data Engineer,"Travel/Relocation: Must be open to both
Start date: September 20th

Working at Capgemini:

Are you interested in working in a high-tech global consulting firm focused on digital transformations and tech solution implementations? We are looking for a goal oriented compassionate person who can work in a fast-paced environment. Due to our rapid growth we are looking to hire a motivated person who is excited to take the next steps with Capgemini.",3.8,$10+ billion (USD),Information Technology,10000+ Employees,Enterprise Software & Network Solutions,Company - Public,"Plano, TX"
9,Employer Provided Salary:$58 - $67 Per Hour,1967,Urbane Systems LLC,Data Scientist,"Travel/Relocation: Must be open to both
Start date: September 20th

Working at Capgemini:

Are you interested in working in a high-tech global consulting firm focused on digital transformations and tech solution implementations? We are looking for a goal oriented compassionate person who can work in a fast-paced environment. Due to our rapid growth we are looking to hire a motivated person who is excited to take the next steps with Capgemini.",3.8,,,10000+ Employees,Enterprise Software & Network Solutions,Company - Public,"Sterling, VA"
10,Employer Provided Salary:$58 - $67 Per Hour,,Health Data Analytics Institute,"Data Analyst, Population Health","Responsibilities
Prepare data science business cases while working with domain experts and customers. Support defining the AI strategy within a federal government agency.
Independently develops customized algorithms to solve analytical problems with incomplete data sets and implements automated processes for efficiently producing scale models.
Independently conducts statistical modelling, machine learning modelling and experiment design, and tests and validates predictive models.
Perform statistical analysis, data mining, temporal and pattern analysis, correlation of events, predictive modelling, and pattern recognition.
Document and visualize analytics both temporally and spatially, and present analytic results and uncertainty to decision makers.",,,,,,,"Dedham, MA"
11,Employer Provided Salary:$110K - $140K,,Citi,"Entry-Level Data Positions (Data Engineer, Machine Learning & Visualization)","Data Analyst, Population Health
HDAI is a well-funded, high-growth, and ambitious startup that is using artificial intelligence to provide clinical and operational guidance that supports population health and clinical decision-making. We are partnering with premier health systems to deploy actionable AI, with a particular focus on delivering insights that support population health initiatives.
We are looking for a statistically savvy, technically adept Data Analyst, Population Health to conduct analyses and develop visualizations with data derived from one of healthcare’s largest data sets. This data scientist will work closely with our research, product, and sales teams to deliver understandable, actionable, and compelling insights.
Key responsibilities",,,,,,,"Irving, TX"
12,,1989,Accenture,Data Science Specialist,"Citi Consumer Technology is seeking dozens of talented entry-level engineers for its Data & Analytics organization, based in Dallas, Texas, and Jacksonville, Fla.
We work with a variety of technologies and are hiring across multiple teams, including Visualization, Data Engineering & Machine Learning Engineering. You’ll find more information below on our roles, our interview process, and our commitment to your growth and development.
Applications are accepted year-round, with multiple start dates organized around orientation trainings.
Our Organization
The best way to think about Citi Consumer Technology is that we’re a tech company inside a bank. We develop software that has a variety of end users: mobile apps and websites that help our customers manage their money, desktop software that allows our customer service agents to provide help and advice, and internal databases, microservices or tools that teams at Citi rely upon every day.
Technology
Digital Software Engineering",,$10+ billion (USD),Business Services,10000+ Employees,Consulting,Company - Public,"Atlanta Central City Post Offi, GA"
13,,1989,FAAZ Consulting,SAS Data Scientist,"Organization: Corporate Functions/Research
Location: US Negotiable - New York, Boston, Chicago, Atlanta
Accenture is a leading global professional services company, providing a broad range of services and solutions in strategy, consulting, digital, technology and operations. Combining unmatched experience and specialized skills across more than 40 industries and all business functions — underpinned by the world’s largest delivery network — Accenture works at the intersection of business and technology to help clients improve their performance and create sustainable value for their stakeholders. With 505,000 people serving clients in more than 200 cities with operations across 51 countries, Accenture drives innovation to improve the way the world works and lives. Visit us at www.accenture.com.
People in the Corporate Function contribute to the running of Accenture as a high- performance business through specialization within a specific functional area, and grow into internally focused roles by deepening their skills and/or developing new skills within an internal functional area.",4.1,$10+ billion (USD),Business Services,10000+ Employees,Consulting,Company - Public,"Washington, DC"
14,,1989,"VIZIO, Inc.",Data Scientist,"Organization: Corporate Functions/Research
Location: US Negotiable - New York, Boston, Chicago, Atlanta
Accenture is a leading global professional services company, providing a broad range of services and solutions in strategy, consulting, digital, technology and operations. Combining unmatched experience and specialized skills across more than 40 industries and all business functions — underpinned by the world’s largest delivery network — Accenture works at the intersection of business and technology to help clients improve their performance and create sustainable value for their stakeholders. With 505,000 people serving clients in more than 200 cities with operations across 51 countries, Accenture drives innovation to improve the way the world works and lives. Visit us at www.accenture.com.
People in the Corporate Function contribute to the running of Accenture as a high- performance business through specialization within a specific functional area, and grow into internally focused roles by deepening their skills and/or developing new skills within an internal functional area.",4.1,$10+ billion (USD),Business Services,10000+ Employees,Consulting,Company - Public,"Denver, CO"
15,Employer Provided Salary:$91K - $145K,1983,Sam's Club,Data Scientist,,,$10+ billion (USD),Retail,10000+ Employees,General Merchandise & Superstores,Subsidiary or Business Segment,"Dallas, TX"
16,Employer Provided Salary:$91K - $145K,1983,Digital Trike,Data Science & Analytics,"What you'll do...
Data Scientists in Walmart Global Tech – Sam’s Technology are responsible for analyzing large data sets to develop custom models and algorithms to help with merchandising and operational projects, such as demand forecasting, assortment planning, price optimization and space planning. Data Scientists work as a member in project teams to provide analytical support, prescriptive models, and optimization solutions in Sam’s Club.
As a Data Scientist, you are responsible for building large data sets from multiple sources, build algorithms for predicting future data characteristics and suggest optimal decision to our business stakeholders. Those algorithms will be tested, validated, and converted into applications. You will have a unique opportunity to expand your domain knowledge on ML/AI use cases in retail, research new trends in the industry and put them into practice.
Key Responsibilities",3.3,$10+ billion (USD),Retail,10000+ Employees,General Merchandise & Superstores,Subsidiary or Business Segment,"South Jordan, UT"
17,Employer Provided Salary:$23 - $31 Per Hour,,Treeco Group,Data Engineer,,,,,,,,"Chicago, IL"
18,Employer Provided Salary:$23 - $31 Per Hour,,FinTek Solutions LLC,Data Science,"We’re looking for an experienced Data Engineer with a strong background in statistics and SQL, Python and/or R skills to join our team! Do you want a role where you can really make a difference? Then this role could be perfect for you! In this role you will apply your deep expertise in analytics and data science techniques to enable better customer understanding and inform business decisioning for us.
Key Responsibilities
Contribute to a shared analytics architecture and plan for machine decisioning, claims optimisation and manage components of delivery to that plan.
Elicit and understand stakeholder needs before scoping and developing analytical methodologies to generate training data and build advanced analytical models and solutions with a view to activating them within business processes.
Adopt a product management approach to deliver valuable improvements often, continuously improve and meet stakeholder needs.",,,,,,,"Tampa, FL"
19,Employer Provided Salary:$54K - $80K,2000,FedEx Services,Data Analyst,"Job Description
Visas accepted- H1B, H4-EAD, GC, GC-EAD, US Citizens, OPT
Must have :
TensorFlow 2.0 and above, TF sequential and Functional model,
TF activations functions : Must have hands on knowledge of RELU, Softmax, Tanh, Sigmoid
TF keras losses : Must have hands on MeanAbsxx, MeanSqxx and CrossEntropy
Keras, Keras functional API
Python - deep hands on knowledge of pandas and scikit
SQL , Stored procedures, Views
Linux : Reasonable working knowledge required, including basic shell scripting.
Nice to have : SQL Alchemy, CX_Oracle or similar direct to pandas integration with SQL. Tableau , Looker",4.1,$1 to $5 million (USD),Transportation & Logistics,10000+ Employees,Logistics & Supply Chain,Company - Public,Virginia
20,Employer Provided Salary:$54K - $80K,2000,Pinnacle Group,Data Engineer (Remote 667-1),"Company: FedEx Services
Job Title: Data Analyst
Job Requisition Number: RC389493
Category: Decision Science & Analytics
Pay Type: Exempt
Locations:
Remote, Tennessee 38120
United States

Oklahoma City, Oklahoma 73105
United States

Compensation: Monthly Salary $4504.12 - $6688.92
The estimate displayed represents the typical salary range or starting rate of candidates hired in Colorado. Factors that may be used to determine your actual salary may include your specific skills, your remote work location (for remote postings), how many years of experience you have, and comparison to other employees already in this role.",4.1,$1 to $5 million (USD),Transportation & Logistics,10000+ Employees,Logistics & Supply Chain,Company - Public,"Memphis, TN"
21,Employer Provided Salary:$53 Per Hour,1989,Facebook,"Data Scientist, Analytics (University Grad)","Company: FedEx Services
Job Title: Data Analyst
Job Requisition Number: RC389493
Category: Decision Science & Analytics
Pay Type: Exempt
Locations:
Remote, Tennessee 38120
United States

Oklahoma City, Oklahoma 73105
United States

Compensation: Monthly Salary $4504.12 - $6688.92
The estimate displayed represents the typical salary range or starting rate of candidates hired in Colorado. Factors that may be used to determine your actual salary may include your specific skills, your remote work location (for remote postings), how many years of experience you have, and comparison to other employees already in this role.",1.5,,,51 to 200 Employees,$25 to $50 million (USD),Company - Public,"Menlo Park, CA"
22,Employer Provided Salary:$29 Per Hour,,Brilliant,Data Visualization Analyst,"Title: Data Engineer
Location: 100% Remote
Rate: $55/hr
Contract: Minimum 1 year

Must Have:
SQL
Hive
Python
Light UNIX",,,,,,,"Lake Forest, IL"
23,Employer Provided Salary:$29 Per Hour,,Pivosys Inc.,Python Developer -With Data Science Experience,"This is a 100% remote role.
No more than 3 years of experience.
Summary:
Data Visualization Analyst , you will be the data expert and advisor for Workforce Analytics. The position is critical in supporting multiple People Disciplines within the business
You will have the opportunity to:
Maintain weekly, monthly and quarterly workforce metrics and analysis
Provide written insights on scheduled and ad hoc data analysis request
Use consulting skills to determine and articulate internal customer business questions, develop the best approach for data analysis and turn data into actionable insights & actions
Support HR data analysis as assigned.
You will love it here if…
You are detail oriented
You thrive in a fast paced and high energy environment
You are a creative and dynamic problem solver
You are committed to excellence",,,,,,,"Sacramento, CA"
24,Employer Provided Salary:$34 - $54 Per Hour,Company - Public,Dell Technologies,Jr Data Scientist-AI/ML (Remote-United States),"Python Developer - With Data Science Experience
C2C
Position is with Cognizant and so should not have a submission with them in the last 3 months. if you applied, don't apply now.
Job Type: Full-time
Pay: $35.00 - $56.00 per hour
Schedule:
8 hour shift",,,,1 to 50 Employees,,Unknown / Non-Applicable,"Round Rock, TX"
25,Employer Provided Salary:$24 - $48 Per Hour,1984,Interview Query,Data Science Content Developer,"Jr Data Scientist-AI/ML (Remote-United States)
Data Science is all about breaking new ground to enable businesses to answer their most urgent questions. Pioneering massively parallel data-intensive analytic processing, our mission is to develop a whole new approach to generating meaning and value from petabyte-scale data sets and shape brand new methodologies, tools, statistical methods and models. What’s more, we are in collaboration with leading academics, industry experts and highly skilled engineers to equip our customers to generate sophisticated new insights from the biggest of big data.
Join us to do the best work of your career and make a profound social impact as a Senior Data Scientist within our Digital IT organization's Digital Analytics and Data Science team.

What you’ll achieve",4.2,,,10000+ Employees,IT Services,Company - Public,Remote
26,Employer Provided Salary:$24 - $48 Per Hour,,Ars Quanta,Data Scientists,"Interview Query is a small data science startup completely remote! Our mission is to help anyone in the data science field pass their interviews and land a data science job with our data science preparation materials.
To help fuel our next phase of growth, we are seeking a high-energy and ambitious Data Science Content Developer to help us with creating learning materials. As a key hire in product and operations, this person's responsibility will be to work on sharing their expertise in data science, analytics, and machine learning to our broader customer base.
You will have the opportunity to work with the founders towards learning how to build a business and grow a business while writing to a target technical demographic. You will have a large scope of responsibility with the ability to see the results of your work reflected immediately. This is a great experience for anyone interested in entrepreneurship.
This is a part time role and is extremely flexible.",,,,,,,"Seattle, WA"
27,,Company - Private,Revelio Labs,"Data Engineer, Dashboard",We are always looking for Data Scientists who want to work on challenging and interesting projects in a variety of industries.,5.0,,$10 to $25 million (USD),1 to 50 Employees,Business Services,Consulting,"New York, NY"
28,,Company - Private,CORMAC,Junior Data Scientist / Entry Level Data Scientist,We are always looking for Data Scientists who want to work on challenging and interesting projects in a variety of industries.,5.0,,$10 to $25 million (USD),1 to 50 Employees,Business Services,Consulting,United States
29,,1957,Toyota,Junior Data Scientist,"Who we are:
Revelio Labs provides workforce intelligence. We absorb and standardize hundreds of millions of public employment records to create the world’s first universal HR database, allowing us to see current workforce composition and trends of any company. Our customers include investors, corporate strategists, HR teams, and governments.
What we're looking for:
Revelio Labs is looking for a Data Engineer with strong software engineering skills to work on a variety of novel problems related to infrastructure platform building, data analysis, and process automation. We prefer candidates who are self motivated and can think creatively about different ways to approach a problem.
Experience:
Master’s Degree in Computer Science or 2+ years of industry experience",3.2,$10+ billion (USD),Manufacturing,10000+ Employees,Transportation Equipment Manufacturing,Company - Public,"Plano, TX"
30,$90K (Employer est.),Company - Private,Envision,Data Scientist with statistics focus – entry level,"Data Scientist with MS in Statistics or Biostatistics

No C2C, must be our W2 employee, will consider qualified OPT EAD

Must relocate to West Sacramento, CA after the pandemic

Required Qualifications:
MS in biostatistics or statistics.
Sophisticated programming skill in R, Python, and experience in SAS.
Good at a wide range of statistical techniques including, but not limited to, experimental design, general and generalized linear mixed models, multivariate statistics, non-parametric analysis, and statistics.
Working experience, including graduate research projects, in machine learning algorithms.",,,Unknown / Non-Applicable,51 to 200 Employees,Business Services,Advertising & Marketing,"West Sacramento, CA"
31,$90K (Employer est.),1994,Walmart,Data Scientist,"Data Scientist with MS in Statistics or Biostatistics

No C2C, must be our W2 employee, will consider qualified OPT EAD

Must relocate to West Sacramento, CA after the pandemic

Required Qualifications:
MS in biostatistics or statistics.
Sophisticated programming skill in R, Python, and experience in SAS.
Good at a wide range of statistical techniques including, but not limited to, experimental design, general and generalized linear mixed models, multivariate statistics, non-parametric analysis, and statistics.
Working experience, including graduate research projects, in machine learning algorithms.",,$10+ billion (USD),Retail,51 to 200 Employees,General Merchandise & Superstores,Company - Public,"Dallas, TX"
