,Salary Estimate,Founded,Company Name,Job Title,Job Description,Rating,Revenue,Sector,Size,Industry,Type of Ownership,Location
444,$56K - $118K (Employer est.),1941,FedEx Services,,"The primary purpose of the Coordinator, Research Data position is to perform basic level-specific activities related to research projects and studies, requiring judgment, initiative, and independent decision making. The Coordinator, Research Data is responsible for activities associated with cancer prevention and smoking cessation projects, which impact behavioral science research protocols.

The ideal candidate will be comfortable with blood, saliva and urine collection.

JOB SPECIFIC COMPETENCIES

Data Collection/Data Entry/Chart Review:

* Administer phone screening questionnaires, both over the phone and in person. Verify participant-provided information. Enter data collected during phone screening and study visits into the appropriate databases per protocol specific timelines (i.e., Meeting Room Manager and access databases) and monitor participants study participation and attendance. Documents study specific information appropriately on source documents following institutional policy and in the study database. Enters protocol-specific data points into the appropriate database in an appropriate timeframe as established by study management. Reviews data forms for completeness and updates as needed. Addresses missing data in timeframe outlined by study management. Creates, prints, and distributes forms using computer and printer. Utilizes computer for word processing, spread sheets and retrieve patient data.
Participate in self audits as well as checking charts of others to ensure accuracy and integrity of data collection, and resolve discrepancies from monitoring visits.



Obtain physiological measurements, including blood pressure, heart rate, height, weight, expired carbon monoxide levels, and blood alcohol levels when applicable, ECG when applicable, as well as blood, urine, and saliva specimen collection and processing. Store samples according to study guidelines. Perform QA on samples as requested.



Answer questions and correspond with study participants via phone, mail, or e-mail. Mail or email reminder letters and other participant-related correspondence. Communicate with PI, Research Manager, Medical team, Study Coordinator(s, supervisor, data team, and space providers through oral and written communication regarding project related issues and/or patient care issues. Follow up with participants as required and coordinate contact with medical team or counselors when necessary. Attend and participate in biweekly project meetings aimed at discussing recruitment goals/status, protocol and/or procedural changes.
Interacts with members of interdisciplinary team inter and intra-departmentally to request information and verify the status of ongoing projects. Communicates clearly and professionally in telephone and email communications and face-to-face encounters with institutional and other personnel and study participants. Receives, places, and transfers calls using appropriate etiquette; responds to information requests with courtesy, accuracy, and respect for confidentiality. Faxes documents to other institutional departments and outside organizations/physician offices as requested. Utilizes and accesses departmental/institutional e-mail to send and receive documents and messages via computer.

Other duties as assigned.

EDUCATION:
Required: High school diploma or equivalent.

Preferred: Bachelor's degree.

EXPERIENCE:
Required: Two years of related experience. With preferred degree, no experience required.

Preferred: Comfortable with blood, saliva and urine collection. Research experience is a plus.

It is the policy of The University of Texas MD Anderson Cancer Center to provide equal employment opportunity without regard to race, color, religion, age, national origin, sex, gender, sexual orientation, gender identity/expression, disability, protected veteran status, genetic information, or any other basis protected by institutional policy or by federal, state or local laws unless such distinction is required by law. http://www.mdanderson.org/about-us/legal-and-policy/legal-statements/eeo-affirmative-action.html

Additional Information",4.2,$2 to $5 billion (USD),Health Care,10000+ Employees,Health Care Services & Hospitals,Hospital,Virginia
445,$56K - $118K (Employer est.),2000,Pinnacle Group,,"Company: FedEx Services
Job Title: Data Analyst
Job Requisition Number: RC389493
Category: Decision Science & Analytics
Pay Type: Exempt
Locations:
Remote, Tennessee 38120
United States

Oklahoma City, Oklahoma 73105
United States

Compensation: Monthly Salary $4504.12 - $6688.92
The estimate displayed represents the typical salary range or starting rate of candidates hired in Colorado. Factors that may be used to determine your actual salary may include your specific skills, your remote work location (for remote postings), how many years of experience you have, and comparison to other employees already in this role.",4.1,$1 to $5 million (USD),Transportation & Logistics,10000+ Employees,Logistics & Supply Chain,Company - Public,"Memphis, TN"
446,$56K - $118K (Employer est.),1821,George Washington University,,"Title: Data Engineer
Location: 100% Remote
Rate: $55/hr
Contract: Minimum 1 year

Must Have:
SQL
Hive
Python
Light UNIX",,$1 to $2 billion (USD),Education,1001 to 5000 Employees,Colleges & Universities,College / University,United States
447,$56K - $118K (Employer est.),Company - Private,FAAZ Consulting,,"The Department of Environmental & Occupational Health is seeking to fill a Research Associate, Data Science position for the research group of Associate Professor Susan Anenberg. Dr. Anenberg’s main interests are quantifying health impacts of climate change and air pollution from local to global scales, including developing scientific methods and evaluating policy scenarios for mitigation. This research is interdisciplinary and draws from a variety of fields, including atmospheric science, epidemiology, and economics. The Research Associate will be co-advised by Dr. Anenberg and Research Scientist Dr. Dan Goldberg.

Ability to exercise independent judgment, think critically and logically to overcome problems, and work under minimal supervision is essential.
The primary responsibility is to support NASA grants on using satellite remote sensing to characterize air pollution and climate change, and their public health impacts and opportunities for mitigation. This work may include data cleaning, processing, and analysis; developing webpages; and communicating with GW faculty and staff and external partners. Important geospatial datasets used for this research include satellite remote sensing of environmental characteristics such as air quality (e.g. globally gridded nitrogen dioxide column densities from the Ozone Monitoring Instrument, OMI, and the TROPOspheric Monitoring Instrument, TROPOMI) and vegetation and green space (e.g. globally gridded normalized difference vegetation index, NDVI), demographic variables (e.g. census block, block group, and tract data from the U.S. Census), and output from environmental models (e.g. gridded air pollution levels over urban, regional, and global areas).



Salary is commensurate with training level and experience.
Minimum Qualifications:
Additional Required Licenses/Certifications/Posting Specific Minimum Qualifications: Preferred Qualifications:

Typical Hiring Range $23.74 - $33.21 How is pay for new employees determined at GW?",2.4,,,201 to 500 Employees,,Unknown / Non-Applicable,"Washington, DC"
448,$56K - $118K (Employer est.),1928,Delta,,"Experience using Python
Experience with probabilistic modelling, clustering and deep learning frameworks
Experience with SQL and NoSQL
SAS Data Scientist Certification
Job Type: Full-time
Pay: $90.00 - $110.00 per hour
License/Certification:
SAS Data Scientist Certification (Preferred)",4.4,$10+ billion (USD),Travel & Tourism,10000+ Employees,Airlines,Company - Public,"Atlanta Central City Post Offi, GA"
449,$56K - $118K (Employer est.),1928,Mitre Corporation,,"United States, Georgia, Atlanta
Inflight Services
15-Jul-2021
Ref #: 7941 How you'll help us Keep Climbing (overview & key responsibilities)
The Specialist will be responsible for driving all OBS Forecast for passenger supplies. These forecasts will include forward projections for supplier production as well as projections for the procurement function.

Work closely across the organization with the stakeholders of the OBS planning, service delivery, supply chain management, and finance groups to generate operational inventory projections
Generate station and warehouse targets (maximum order quantities) based on flight schedule and provisioning estimates
Work closely with the OnBoard Services operational teams to understand operational changes and how they will impact inventory needs
Assist in the development of a new forecasting tools
Identify and develop reports for commonly requested forecast needs
Create dashboards for business users
Clearly articulate forecasting assumptions
Work with operational team to continuously cleanse data with the expectation of constantly improving forecast projections
Be well versed in all OBS processes to help brainstorm process improvement opportunities

What you need to succeed (minimum qualifications)
Where permitted by applicable law, must have received or be willing to receive the COVID-19 vaccine by date of hire to be considered for U.S.-based job, if not currently employed by Delta Air Lines, Inc.
Embraces diverse people, thinking and styles
Consistently makes safety and security, of self and others, the priority
Advanced degree or certification in statistics, information technology, supply chain, IT, business management, engineering or related field
Knowledge of SQL required
Experience with data science tools (R, Python, SAS) preferred
Excellent data analytical skillsable to pull together and combine data from disparate sources to analyze and summarize into recommendations and actions
Excellent cross-organization problem resolution and communication skills
Demonstrated Leadership Potential

What will give you a competitive edge (preferred qualifications) N/A < Go back",4.4,$10+ billion (USD),Travel & Tourism,10000+ Employees,Airlines,Company - Public,United States
450,$56K - $118K (Employer est.),1812,Citi,"Entry-Level Data Positions (Data Engineer, Machine Learning & Visualization)","Citi Consumer Technology is seeking dozens of talented entry-level engineers for its Data & Analytics organization, based in Dallas, Texas, and Jacksonville, Fla.
We work with a variety of technologies and are hiring across multiple teams, including Visualization, Data Engineering & Machine Learning Engineering. You’ll find more information below on our roles, our interview process, and our commitment to your growth and development.
Applications are accepted year-round, with multiple start dates organized around orientation trainings.
Our Organization
The best way to think about Citi Consumer Technology is that we’re a tech company inside a bank. We develop software that has a variety of end users: mobile apps and websites that help our customers manage their money, desktop software that allows our customer service agents to provide help and advice, and internal databases, microservices or tools that teams at Citi rely upon every day.
Technology
Digital Software Engineering",3.9,$10+ billion (USD),Finance,10000+ Employees,Investment Banking & Asset Management,Company - Public,"Irving, TX"
451,$56K - $118K (Employer est.),1812,Accenture,Data Science Specialist,"Citi Consumer Technology is seeking dozens of talented entry-level engineers for its Data & Analytics organization, based in Dallas, Texas, and Jacksonville, Fla.
We work with a variety of technologies and are hiring across multiple teams, including Visualization, Data Engineering & Machine Learning Engineering. You’ll find more information below on our roles, our interview process, and our commitment to your growth and development.
Applications are accepted year-round, with multiple start dates organized around orientation trainings.
Our Organization
The best way to think about Citi Consumer Technology is that we’re a tech company inside a bank. We develop software that has a variety of end users: mobile apps and websites that help our customers manage their money, desktop software that allows our customer service agents to provide help and advice, and internal databases, microservices or tools that teams at Citi rely upon every day.
Technology
Digital Software Engineering",3.9,$10+ billion (USD),Finance,10000+ Employees,Investment Banking & Asset Management,Company - Public,"Atlanta Central City Post Offi, GA"
452,$56K - $118K (Employer est.),1946,Argonne National Laboratory,Data Scientist - Life Sciences,"Citi Consumer Technology is seeking dozens of talented entry-level engineers for its Data & Analytics organization, based in Dallas, Texas, and Jacksonville, Fla.
We work with a variety of technologies and are hiring across multiple teams, including Visualization, Data Engineering & Machine Learning Engineering. You’ll find more information below on our roles, our interview process, and our commitment to your growth and development.
Applications are accepted year-round, with multiple start dates organized around orientation trainings.
Our Organization
The best way to think about Citi Consumer Technology is that we’re a tech company inside a bank. We develop software that has a variety of end users: mobile apps and websites that help our customers manage their money, desktop software that allows our customer service agents to provide help and advice, and internal databases, microservices or tools that teams at Citi rely upon every day.
Technology
Digital Software Engineering",3.9,Unknown / Non-Applicable,Government,10000+ Employees,Federal Agencies,Nonprofit Organization,"Chicago, IL"
453,$56K - $118K (Employer est.),Company - Private,Envision,Data Scientist,,,,Unknown / Non-Applicable,51 to 200 Employees,Business Services,Advertising & Marketing,"Saint Louis, MO"
454,$56K - $118K (Employer est.),1887,Johnson & Johnson Family of Companies,Data Scientist,"Basic Qualifications:
Masters Degree in Statistics, Biostatistics, Data Science, Applied Mathematics, or another highly quantitative discipline;

Strong Python coding skills for data management, visualization, and basic modeling (strong experience and knowledge with standard data science packages such as numpy, pandas, matplotlib, seaborn, sklearn)

Demonstrated knowledge and experience manipulating and analyzing various data sets

Strong Statistical, machine learning and deep learning modeling experience

Strong analytical and quantitative problem solving ability, with demonstrated ability to build, test, and iterate on a variety of model forms

Fast learner and follows project instructions

Strong communication skills and the ability to work with diverse cross-functional teams


Proven experience with good coding practices such as version control, code documentation, automated testing, and code review

Experience working with agriculture or soybean crop data

Experience working with crop disease management or crop protection

Experience in SQL, PySpark, or SparklyR/Spark

Ability to translate complex technical concepts to collaborations, decision makers, and non-technical audiences",4.2,$10+ billion (USD),Biotech & Pharmaceuticals,10000+ Employees,Biotech & Pharmaceuticals,Company - Public,"Raritan, NJ"
455,$56K - $118K (Employer est.),1996,Novartis,Data Scientist (Machine Learning),"Janssen Pharmaceuticals, Inc., a member of Johnson & Johnson's Family of Companies, is recruiting for a Data Scientist in Janssen Business Technology located in Titusville, NJ, Raritan, NJ or Horsham, PA.
At the Janssen Pharmaceutical Companies of Johnson & Johnson, what matters most is helping people live full and healthy lives. We focus on treating, curing and preventing some of the most devastating and complex diseases of our time. And we pursue the most promising science, wherever it might be found.
The Janssen Pharmaceutical Companies of Johnson & Johnson provide medicines for an array of health concerns in several therapeutic areas. Our ultimate goal is to help people live healthy lives. We have produced and marketed many first-in-class prescription medications and are poised to serve the broad needs of the healthcare market - from patients to practitioners, from clinics to hospitals. For more about the Pharmaceutical Companies of Johnson & Johnson, visit: http://www.janssenpharmaceuticalsinc.com/.
We are Janssen. Our mission drives us. Our patients inspire us. We collaborate with the world for the health of everyone in it.







United States-New Jersey-Titusville-1125 Trenton Harbourton Road

North America-United States-New Jersey-Raritan, North America-United States-Pennsylvania-Horsham

Johnson & Johnson Services Inc. (6090)

R&D

2105949285W",4.2,$10+ billion (USD),Biotech & Pharmaceuticals,10000+ Employees,Biotech & Pharmaceuticals,Company - Public,"Cambridge, MA"
456,$56K - $118K (Employer est.),1957,Toyota,Junior Data Scientist,"6,000 people dedicated to discovery - 6 research campuses across the globe. As a Data Scientist you will be a part of this great community working to enable the next breakthrough in innovative medicines for patients in need. You will be at the forefront of life sciences, tackling some incredible challenges that are curing diseases and improving patients’ lives.

As a member of the Data Science – Machine Learning team, you will explore and develop machine learning and other advanced analysis approaches to drive drug discovery towards novel innovative medicines. Together with wet-lab scientists and other computational colleagues, you will identify tractable machine learning problems in all stages of drug discovery from disease biology mechanistic understanding, to therapeutic target identification, assay development, safety, and patient stratification. In your role, you will work with drug discovery teams from many different disease areas as part of a large community of hundreds of data scientists in NIBR and Novartis.

You will frame key questions, define appropriate data sets, perform data analysis, or train machine learning models to ultimately address key scientific needs for projects. You will collaborate closely with bench scientists, software engineers, statisticians and bioinformaticians to make sense of high-dimensional pre-clinical and clinical data. This will require you to deploy cutting-edge data science techniques on a wide variety of different data types in order to enable drug discovery teams to succeed. As a successful candidate, you must demonstrate the ability to work cross-functionally, to communicate well, and to deliver impactful results.",3.9,$10+ billion (USD),Manufacturing,10000+ Employees,Transportation Equipment Manufacturing,Company - Public,"Plano, TX"
457,$56K - $118K (Employer est.),1989,Accenture,Behavioral Data Science Consultant,"Accenture is a global professional services company with leading capabilities in digital, cloud and security. Combining unmatched experience and specialized skills across more than 40 industries, we offer Strategy and Consulting, Interactive, Technology and Operations services—all powered by the world’s largest network of Advanced Technology and Intelligent Operations centers. Our 514,000 people deliver on the promise of technology and human ingenuity every day, serving clients in more than 120 countries. We embrace the power of change to create value and shared success for our clients, people, shareholders, partners and communities. Visit us at www.accenture.com
We are:
Solutions.AI is Accenture's collection of AI solutions that are designed to unlock new efficiencies and growth, enable new ways of working, and facilitate game-changing innovation–3x faster than the typical product lifecycle. Built and delivered on the foundation of Accenture's unparalleled AI expertise, data services, IP and ecosystem partners, our scalable, modular solutions minimize time to market and maximize business impact. The next AI revolution will be built by people like you. Visit us here to find out more about Solutions.AI.",4.1,$10+ billion (USD),Business Services,10000+ Employees,Consulting,Company - Public,"Austin, TX"
458,$56K - $118K (Employer est.),1967,Capgemini,Entry Level Data Engineer - September Start Date,"Accenture is a global professional services company with leading capabilities in digital, cloud and security. Combining unmatched experience and specialized skills across more than 40 industries, we offer Strategy and Consulting, Interactive, Technology and Operations services—all powered by the world’s largest network of Advanced Technology and Intelligent Operations centers. Our 514,000 people deliver on the promise of technology and human ingenuity every day, serving clients in more than 120 countries. We embrace the power of change to create value and shared success for our clients, people, shareholders, partners and communities. Visit us at www.accenture.com
We are:
Solutions.AI is Accenture's collection of AI solutions that are designed to unlock new efficiencies and growth, enable new ways of working, and facilitate game-changing innovation–3x faster than the typical product lifecycle. Built and delivered on the foundation of Accenture's unparalleled AI expertise, data services, IP and ecosystem partners, our scalable, modular solutions minimize time to market and maximize business impact. The next AI revolution will be built by people like you. Visit us here to find out more about Solutions.AI.",3.8,$10+ billion (USD),Information Technology,10000+ Employees,Enterprise Software & Network Solutions,Company - Public,"New York, NY"
459,$56K - $118K (Employer est.),1995,LOCKHEED MARTIN CORPORATION,Data Scientist Associate - Level 1,"Lockheed Martin Aeronautics. Be More Than You Can Imagine.

Perform Modeling, Simulation & Analysis (MS&A) in support of F-35 Sustainment. Successful candidate will be responsible to : 1) Utilize modeling & simulation technical principles, theories, concepts, and techniques to conduct supportability and Performance Based Logistics (PBL) metrics assessments using commercial, government, and LM developed tools, 2) Work under the guidance of a technical lead to implement improved Sustainment modeling & analysis capabilities in several areas, and 3) Analyze F-35 fielded performance developing solutions to assigned problems for the purpose of forecasting, root cause analysis, evaluation of potential solutions, and assessment of corrective actions.

A level 1 employee Typically has 0 - 3 years of professional experience.

What’s In It For You
Our employees play an active role in strengthening the quality of life where we live and work by volunteering more than 850,000 hours annually. Here are some of the benefits you can enjoy:

Learn more about Lockheed Martin’s comprehensive benefits package here.

This position is in Fort Worth, TX Discover Fort Worth.

This position is in Palmdale, CA Discover Palmdale.

Bachelor of Science degree in Engineering or related technical discipline (Industrial, Mechanical, Aerospace, Electrical, Etc), Physics, Data Science, Data Analysis, Physics, or Mathematics (use of stochastic and deterministic data models) or related technical disciplines with an emphasis in modeling, data manipulation, and/or the application of mathematical and statistical methods to business and risk management problems.

Foundational understanding of a broad set of tools to be able to apply the right tool to each data exploration activity. Tools could include, for example:

job.Qualifications


Join us at Lockheed Martin, where your mission is ours. Our customers tackle the hardest missions. Those that demand extraordinary amounts of courage, resilience and precision. They’re dangerous. Critical. Sometimes they even provide an opportunity to change the world and save lives. Those are the missions we care about.

As a leading technology innovation company, Lockheed Martin’s vast team works with partners around the world to bring proven performance to our customers’ toughest challenges. Lockheed Martin has employees based in many states throughout the U.S., and Internationally, with business locations in many nations and territories.

Experienced Professional",4.1,$10+ billion (USD),Aerospace & Defense,10000+ Employees,Aerospace & Defense,Company - Public,"Fort Worth, TX"
460,$56K - $118K (Employer est.),Company - Public,people*strata,"Associate, Data Science","ENGINE is a media and marketing services company that exists to futureproof clients business. In a fast-changing world, we empower our clients to outperform in the present and win in the future. Driven by data. Fueled by imagination. Powered by technology. Engine is an ecosystem of creative wunderkinds, uber-nerds, business consultants, cultural mavens, and channel specialists working together to help our clients grow. With global headquarters in New York and 16 locations across North America, the UK, Europe, and Asia-Pacific, Engine offers clients a vast range of marketing solutionsincluding insights, content, distribution, data and technology.

POSITION SUMMARY:",5.0,,,1 to 50 Employees,,Unknown / Non-Applicable,"Cincinnati, OH"
