,Salary Estimate,Founded,Company Name,Job Title,Job Description,Rating,Revenue,Sector,Size,Industry,Type of Ownership,Location
273,$23 - $31 Per Hour(Employer est.),Company - Private,Argonne National Laboratory,Data Scientist - Life Sciences,"Basic Qualifications:
Masters Degree in Statistics, Biostatistics, Data Science, Applied Mathematics, or another highly quantitative discipline;

Strong Python coding skills for data management, visualization, and basic modeling (strong experience and knowledge with standard data science packages such as numpy, pandas, matplotlib, seaborn, sklearn)

Demonstrated knowledge and experience manipulating and analyzing various data sets

Strong Statistical, machine learning and deep learning modeling experience

Strong analytical and quantitative problem solving ability, with demonstrated ability to build, test, and iterate on a variety of model forms

Fast learner and follows project instructions

Strong communication skills and the ability to work with diverse cross-functional teams


Proven experience with good coding practices such as version control, code documentation, automated testing, and code review

Experience working with agriculture or soybean crop data

Experience working with crop disease management or crop protection

Experience in SQL, PySpark, or SparklyR/Spark

Ability to translate complex technical concepts to collaborations, decision makers, and non-technical audiences",,,Unknown / Non-Applicable,51 to 200 Employees,Business Services,Advertising & Marketing,"Chicago, IL"
274,$23 - $31 Per Hour(Employer est.),1996,Novartis,Data Scientist (Machine Learning),"Basic Qualifications:
Masters Degree in Statistics, Biostatistics, Data Science, Applied Mathematics, or another highly quantitative discipline;

Strong Python coding skills for data management, visualization, and basic modeling (strong experience and knowledge with standard data science packages such as numpy, pandas, matplotlib, seaborn, sklearn)

Demonstrated knowledge and experience manipulating and analyzing various data sets

Strong Statistical, machine learning and deep learning modeling experience

Strong analytical and quantitative problem solving ability, with demonstrated ability to build, test, and iterate on a variety of model forms

Fast learner and follows project instructions

Strong communication skills and the ability to work with diverse cross-functional teams


Proven experience with good coding practices such as version control, code documentation, automated testing, and code review

Experience working with agriculture or soybean crop data

Experience working with crop disease management or crop protection

Experience in SQL, PySpark, or SparklyR/Spark

Ability to translate complex technical concepts to collaborations, decision makers, and non-technical audiences",4.5,$10+ billion (USD),Biotech & Pharmaceuticals,10000+ Employees,Biotech & Pharmaceuticals,Company - Public,"Cambridge, MA"
275,$23 - $31 Per Hour(Employer est.),1996,Toyota,Junior Data Scientist,"6,000 people dedicated to discovery - 6 research campuses across the globe. As a Data Scientist you will be a part of this great community working to enable the next breakthrough in innovative medicines for patients in need. You will be at the forefront of life sciences, tackling some incredible challenges that are curing diseases and improving patients’ lives.

As a member of the Data Science – Machine Learning team, you will explore and develop machine learning and other advanced analysis approaches to drive drug discovery towards novel innovative medicines. Together with wet-lab scientists and other computational colleagues, you will identify tractable machine learning problems in all stages of drug discovery from disease biology mechanistic understanding, to therapeutic target identification, assay development, safety, and patient stratification. In your role, you will work with drug discovery teams from many different disease areas as part of a large community of hundreds of data scientists in NIBR and Novartis.

You will frame key questions, define appropriate data sets, perform data analysis, or train machine learning models to ultimately address key scientific needs for projects. You will collaborate closely with bench scientists, software engineers, statisticians and bioinformaticians to make sense of high-dimensional pre-clinical and clinical data. This will require you to deploy cutting-edge data science techniques on a wide variety of different data types in order to enable drug discovery teams to succeed. As a successful candidate, you must demonstrate the ability to work cross-functionally, to communicate well, and to deliver impactful results.",4.2,$10+ billion (USD),Biotech & Pharmaceuticals,10000+ Employees,Biotech & Pharmaceuticals,Company - Public,"Plano, TX"
276,$23 - $31 Per Hour(Employer est.),1887,Johnson & Johnson Family of Companies,Data Scientist,"Who We Are
Collaborative. Respectful. A place to dream and do. These are just a few words that describe what life is like at Toyota. As one of the world's most admired brands, Toyota is growing and leading the future of mobility through innovative, high-quality solutions designed to enhance lives and delight those we serve. We're looking for diverse, talented team members who want to Dream. Do. Grow. with us.
An important part of the Toyota family is Toyota Financial Services (TFS), the finance and insurance brand for Toyota and Lexus in North America. While TFS is a separate business entity, it is an essential part of this world-changing company – delivering on Toyota's vision to move people beyond what's possible. At TFS, you will help create best-in-class customer experiences in an innovative, collaborative environment.
Who We're Looking For",4.2,$10+ billion (USD),Biotech & Pharmaceuticals,10000+ Employees,Biotech & Pharmaceuticals,Company - Public,"Raritan, NJ"
277,$23 - $31 Per Hour(Employer est.),1887,Treeco Group,Data Engineer,"Janssen Pharmaceuticals, Inc., a member of Johnson & Johnson's Family of Companies, is recruiting for a Data Scientist in Janssen Business Technology located in Titusville, NJ, Raritan, NJ or Horsham, PA.
At the Janssen Pharmaceutical Companies of Johnson & Johnson, what matters most is helping people live full and healthy lives. We focus on treating, curing and preventing some of the most devastating and complex diseases of our time. And we pursue the most promising science, wherever it might be found.
The Janssen Pharmaceutical Companies of Johnson & Johnson provide medicines for an array of health concerns in several therapeutic areas. Our ultimate goal is to help people live healthy lives. We have produced and marketed many first-in-class prescription medications and are poised to serve the broad needs of the healthcare market - from patients to practitioners, from clinics to hospitals. For more about the Pharmaceutical Companies of Johnson & Johnson, visit: http://www.janssenpharmaceuticalsinc.com/.
We are Janssen. Our mission drives us. Our patients inspire us. We collaborate with the world for the health of everyone in it.







United States-New Jersey-Titusville-1125 Trenton Harbourton Road

North America-United States-New Jersey-Raritan, North America-United States-Pennsylvania-Horsham

Johnson & Johnson Services Inc. (6090)

R&D

2105949285W",4.2,,Biotech & Pharmaceuticals,10000+ Employees,Biotech & Pharmaceuticals,Company - Public,"Chicago, IL"
278,$23 - $31 Per Hour(Employer est.),,LOCKHEED MARTIN CORPORATION,Data Scientist Associate - Level 1,"We’re looking for an experienced Data Engineer with a strong background in statistics and SQL, Python and/or R skills to join our team! Do you want a role where you can really make a difference? Then this role could be perfect for you! In this role you will apply your deep expertise in analytics and data science techniques to enable better customer understanding and inform business decisioning for us.
Key Responsibilities
Contribute to a shared analytics architecture and plan for machine decisioning, claims optimisation and manage components of delivery to that plan.
Elicit and understand stakeholder needs before scoping and developing analytical methodologies to generate training data and build advanced analytical models and solutions with a view to activating them within business processes.
Adopt a product management approach to deliver valuable improvements often, continuously improve and meet stakeholder needs.",,$10+ billion (USD),Aerospace & Defense,,Aerospace & Defense,Company - Public,"Fort Worth, TX"
279,$23 - $31 Per Hour(Employer est.),1995,Accenture,Federal - Data Visualization Specialist,"Lockheed Martin Aeronautics. Be More Than You Can Imagine.

Perform Modeling, Simulation & Analysis (MS&A) in support of F-35 Sustainment. Successful candidate will be responsible to : 1) Utilize modeling & simulation technical principles, theories, concepts, and techniques to conduct supportability and Performance Based Logistics (PBL) metrics assessments using commercial, government, and LM developed tools, 2) Work under the guidance of a technical lead to implement improved Sustainment modeling & analysis capabilities in several areas, and 3) Analyze F-35 fielded performance developing solutions to assigned problems for the purpose of forecasting, root cause analysis, evaluation of potential solutions, and assessment of corrective actions.

A level 1 employee Typically has 0 - 3 years of professional experience.

What’s In It For You
Our employees play an active role in strengthening the quality of life where we live and work by volunteering more than 850,000 hours annually. Here are some of the benefits you can enjoy:

Learn more about Lockheed Martin’s comprehensive benefits package here.

This position is in Fort Worth, TX Discover Fort Worth.

This position is in Palmdale, CA Discover Palmdale.

Bachelor of Science degree in Engineering or related technical discipline (Industrial, Mechanical, Aerospace, Electrical, Etc), Physics, Data Science, Data Analysis, Physics, or Mathematics (use of stochastic and deterministic data models) or related technical disciplines with an emphasis in modeling, data manipulation, and/or the application of mathematical and statistical methods to business and risk management problems.

Foundational understanding of a broad set of tools to be able to apply the right tool to each data exploration activity. Tools could include, for example:

job.Qualifications


Join us at Lockheed Martin, where your mission is ours. Our customers tackle the hardest missions. Those that demand extraordinary amounts of courage, resilience and precision. They’re dangerous. Critical. Sometimes they even provide an opportunity to change the world and save lives. Those are the missions we care about.

As a leading technology innovation company, Lockheed Martin’s vast team works with partners around the world to bring proven performance to our customers’ toughest challenges. Lockheed Martin has employees based in many states throughout the U.S., and Internationally, with business locations in many nations and territories.

Experienced Professional",4.1,$10+ billion (USD),Aerospace & Defense,10000+ Employees,Aerospace & Defense,Company - Public,"Arlington, VA"
280,$23 - $31 Per Hour(Employer est.),1989,Toyota,Data Scientist,"Organization: Accenture Federal Services
Location: Washington, DC
We are:
Accenture Federal Services, helping our federal clients tackle their toughest challenges while unleashing their fullest potential…and then some. What makes our approach so unique? Operating from the nation’s capital, we bring together commercial innovation and leading-edge technologies to deliver an integrated and interactive experience that far exceeds expectations. How? Our passion meets purpose! Through our diverse culture and inclusive thinking, we embrace our employees' ideas taking them from concept to practical solutions. Not to mention, we sleep well at night knowing our work directly impacts and improves the way the world works. We keep our tech smarts sharp by providing abundant training and certification opportunities. Are you ready to learn and grow in a career, while making a difference?",4.1,$10+ billion (USD),Business Services,10000+ Employees,Consulting,Company - Public,"Plano, TX"
281,$23 - $31 Per Hour(Employer est.),1989,Accenture,Behavioral Data Science Consultant,"Organization: Accenture Federal Services
Location: Washington, DC
We are:
Accenture Federal Services, helping our federal clients tackle their toughest challenges while unleashing their fullest potential…and then some. What makes our approach so unique? Operating from the nation’s capital, we bring together commercial innovation and leading-edge technologies to deliver an integrated and interactive experience that far exceeds expectations. How? Our passion meets purpose! Through our diverse culture and inclusive thinking, we embrace our employees' ideas taking them from concept to practical solutions. Not to mention, we sleep well at night knowing our work directly impacts and improves the way the world works. We keep our tech smarts sharp by providing abundant training and certification opportunities. Are you ready to learn and grow in a career, while making a difference?",4.1,$10+ billion (USD),,10000+ Employees,Consulting,Company - Public,"Austin, TX"
282,$23 - $31 Per Hour(Employer est.),1957,PayPal,Data Scientist 3,"Who We Are
Collaborative. Respectful. A place to dream and do. These are just a few words that describe what life is like at Toyota. As one of the world's most admired brands, Toyota is growing and leading the future of mobility through innovative, high-quality solutions designed to enhance lives and delight those we serve. We're looking for diverse, talented team members who want to Dream. Do. Grow. with us.
An important part of the Toyota family is Toyota Financial Services (TFS), the finance and insurance brand for Toyota and Lexus in North America. While TFS is a separate business entity, it is an essential part of this world-changing company – delivering on Toyota's vision to move people beyond what's possible. At TFS, you will help create best-in-class customer experiences in an innovative, collaborative environment.
Who We're Looking For",3.9,$10+ billion (USD),Manufacturing,10000+ Employees,Transportation Equipment Manufacturing,Company - Public,"Wilmington, DE"
283,$23 - $31 Per Hour(Employer est.),1998,Capgemini,Entry Level Data Engineer - September Start Date,"Who we are: Fueled by a fundamental belief that having access to financial services creates opportunity, PayPal (NASDAQ: PYPL) is committed to democratizing financial services and empowering people and businesses to join and thrive in the global economy. Our open digital payments platform gives PayPal’s 392 million active account holders the confidence to connect and transact in new and powerful ways, whether they are online, on a mobile device, in an app, or in person. Through a combination of technological innovation and strategic partnerships, PayPal creates better ways to manage and move money, and offers choice and flexibility when sending payments, paying or getting paid. Available in more than 200 markets around the world, the PayPal platform, including Braintree, Venmo and Xoom enables consumers and merchants to receive money in more than 100 currencies, withdraw funds in 56 currencies and hold balances in their PayPal accounts in 25 currencies.
Job Description Summary: Fueled by a fundamental belief that having access to financial services creates opportunity, PayPal (NASDAQ: PYPL) is committed to democratizing financial services and empowering people and businesses to join and thrive in the global economy. Our open digital payments platform gives PayPal’s 392 million active account holders the confidence to connect and transact in new and powerful ways, whether they are online, on a mobile device, in an app, or in person. Through a combination of technological innovation and strategic partnerships, PayPal creates better ways to manage and move money, and offers choice and flexibility when sending payments, paying or getting paid. Available in more than 200 markets around the world, the PayPal platform, including Braintree, Venmo and Xoom enables consumers and merchants to receive money in more than 100 currencies, withdraw funds in 56 currencies and hold balances in their PayPal accounts in 25 currencies. Looking for a seasoned analytics professional to join the Global Merchant Lending analytics team and make an immediate impact. The ideal candidate is highly skilled in credit card marketing analytics and can deliver results for our stakeholders.",4.1,$10+ billion (USD),Information Technology,10000+ Employees,Internet,Company - Public,"New York, NY"
284,$23 - $31 Per Hour(Employer est.),1967,RMDS Lab,Data Scientist for GRMDS.org,"Travel/Relocation: Must be open to both
Start date: September 20th

Working at Capgemini:

Are you interested in working in a high-tech global consulting firm focused on digital transformations and tech solution implementations? We are looking for a goal oriented compassionate person who can work in a fast-paced environment. Due to our rapid growth we are looking to hire a motivated person who is excited to take the next steps with Capgemini.",3.8,,,10000+ Employees,,Company - Public,"Pasadena, CA"
285,$23 - $31 Per Hour(Employer est.),,Bayer,Precision Genomics Data Science Co-Op,"We are looking for a Data Scientist to analyze large amounts of raw information to find patterns and insights that will help our company and our clients. We will rely on you to build data products to extract valuable business insights. In this role, you should be highly analytical with a knack for analysis, math and statistics. Critical thinking and problem-solving skills are essential for interpreting data. We want to see a passion for machine-learning and research. Your goal will be to help our company and our clients analyze trends to make better decisions.
Responsibilities
Identify valuable data sources and automate collection processes
Undertake preprocessing of structured and unstructured data
Analyze large amounts of information to discover trends and patterns",,,,,,,"Chesterfield, MO"
286,$23 - $31 Per Hour(Employer est.),1863,Facebook,"Research Scientist, Optimization Research (Core Data Science - PhD)","We are looking for a Data Scientist to analyze large amounts of raw information to find patterns and insights that will help our company and our clients. We will rely on you to build data products to extract valuable business insights. In this role, you should be highly analytical with a knack for analysis, math and statistics. Critical thinking and problem-solving skills are essential for interpreting data. We want to see a passion for machine-learning and research. Your goal will be to help our company and our clients analyze trends to make better decisions.
Responsibilities
Identify valuable data sources and automate collection processes
Undertake preprocessing of structured and unstructured data
Analyze large amounts of information to discover trends and patterns",,$10+ billion (USD),Information Technology,,Internet,Company - Public,"Menlo Park, CA"
287,$23 - $31 Per Hour(Employer est.),2004,George Washington University,"Research Associate, Data Science","We are looking for Research Scientists with an Operations Research background to join the Core Data Science team. Core Data Science is an interdisciplinary team of quantitative scientists that aims to deliver research and innovation that fundamentally increase the magnitude of Facebook's successes. The ideal candidate will have extensive graduate training in Operations Research methods, and an interest in answering challenging, open-ended research questions with real-world impact. Expertise in one or more of the following fields is preferred: linear programming, non-linear programming, queueing systems, game theory, operations management, and stochastic modeling.
Answer important product and business questions, by applying appropriate Operations Research methods.
Identify new areas across the family of Facebook apps and products, where Operations Research methods can drive product improvements.
Synthesize and apply relevant insights from the academic literature on Operations Research to Facebook’s products.",4.4,$10+ billion (USD),Information Technology,10000+ Employees,Internet,Company - Public,United States
288,$23 - $31 Per Hour(Employer est.),1989,Pinnacle Group,Data Engineer (Remote 667-1),"The Department of Environmental & Occupational Health is seeking to fill a Research Associate, Data Science position for the research group of Associate Professor Susan Anenberg. Dr. Anenberg’s main interests are quantifying health impacts of climate change and air pollution from local to global scales, including developing scientific methods and evaluating policy scenarios for mitigation. This research is interdisciplinary and draws from a variety of fields, including atmospheric science, epidemiology, and economics. The Research Associate will be co-advised by Dr. Anenberg and Research Scientist Dr. Dan Goldberg.

Ability to exercise independent judgment, think critically and logically to overcome problems, and work under minimal supervision is essential.
The primary responsibility is to support NASA grants on using satellite remote sensing to characterize air pollution and climate change, and their public health impacts and opportunities for mitigation. This work may include data cleaning, processing, and analysis; developing webpages; and communicating with GW faculty and staff and external partners. Important geospatial datasets used for this research include satellite remote sensing of environmental characteristics such as air quality (e.g. globally gridded nitrogen dioxide column densities from the Ozone Monitoring Instrument, OMI, and the TROPOspheric Monitoring Instrument, TROPOMI) and vegetation and green space (e.g. globally gridded normalized difference vegetation index, NDVI), demographic variables (e.g. census block, block group, and tract data from the U.S. Census), and output from environmental models (e.g. gridded air pollution levels over urban, regional, and global areas).



Salary is commensurate with training level and experience.
Minimum Qualifications:
Additional Required Licenses/Certifications/Posting Specific Minimum Qualifications: Preferred Qualifications:

Typical Hiring Range $23.74 - $33.21 How is pay for new employees determined at GW?",1.5,,,51 to 200 Employees,$25 to $50 million (USD),Company - Public,"Memphis, TN"
289,$23 - $31 Per Hour(Employer est.),1989,Piper Companies,Data Review Associate Scientist,"Title: Data Engineer
Location: 100% Remote
Rate: $55/hr
Contract: Minimum 1 year

Must Have:
SQL
Hive
Python
Light UNIX",1.5,,,51 to 200 Employees,$25 to $50 million (USD),Company - Public,"King of Prussia, PA"
290,$23 - $31 Per Hour(Employer est.),2011,Atlanta Regional Commission,Data Visualization Assistant – PT Temp,"Piper Clinical Solutions is actively seeking a Data Review Associate Scientist to work at a global biopharmaceutical company in the greater Philadelphia PA area.

Responsibilities for Data Review Associate Scientist:
Collect, enter, review and analyze data into LIMS system and assess for any possible deviations
Assess data and calculations to determine correctness and adherence to GMP compliance
Interact with scientists to catch mistakes, clarify requirements and explain necessary documentation then follow up on changes needed
Verify that data analysis and reporting is consistent with assay methodology and GMP requirements.",4.3,Unknown / Non-Applicable,Business Services,201 to 500 Employees,Staffing & Outsourcing,Company - Private,"Atlanta Central City Post Offi, GA"
291,$23 - $31 Per Hour(Employer est.),2011,Pivosys Inc.,Python Developer -With Data Science Experience,"Piper Clinical Solutions is actively seeking a Data Review Associate Scientist to work at a global biopharmaceutical company in the greater Philadelphia PA area.

Responsibilities for Data Review Associate Scientist:
Collect, enter, review and analyze data into LIMS system and assess for any possible deviations
Assess data and calculations to determine correctness and adherence to GMP compliance
Interact with scientists to catch mistakes, clarify requirements and explain necessary documentation then follow up on changes needed
Verify that data analysis and reporting is consistent with assay methodology and GMP requirements.",4.3,,,201 to 500 Employees,Staffing & Outsourcing,Company - Private,"Sacramento, CA"
292,$23 - $31 Per Hour(Employer est.),Company - Public,FAAZ Consulting,SAS Data Scientist,"Python Developer - With Data Science Experience
C2C
Position is with Cognizant and so should not have a submission with them in the last 3 months. if you applied, don't apply now.
Job Type: Full-time
Pay: $35.00 - $56.00 per hour
Schedule:
8 hour shift",,,,1 to 50 Employees,,Unknown / Non-Applicable,"Washington, DC"
293,$23 - $31 Per Hour(Employer est.),Company - Private,Delta,Specialist,"Experience using Python
Experience with probabilistic modelling, clustering and deep learning frameworks
Experience with SQL and NoSQL
SAS Data Scientist Certification
Job Type: Full-time
Pay: $90.00 - $110.00 per hour
License/Certification:
SAS Data Scientist Certification (Preferred)",2.4,,,201 to 500 Employees,,Unknown / Non-Applicable,"Atlanta Central City Post Offi, GA"
