,Salary Estimate,Founded,Company Name,Job Title,Job Description,Rating,Revenue,Sector,Size,Industry,Type of Ownership,Location
152,$14 - $16 Per Hour(Employer est.),1989,Bayer,Precision Genomics Data Science Co-Op,"Accenture is a global professional services company with leading capabilities in digital, cloud and security. Combining unmatched experience and specialized skills across more than 40 industries, we offer Strategy and Consulting, Interactive, Technology and Operations services—all powered by the world’s largest network of Advanced Technology and Intelligent Operations centers. Our 514,000 people deliver on the promise of technology and human ingenuity every day, serving clients in more than 120 countries. We embrace the power of change to create value and shared success for our clients, people, shareholders, partners and communities. Visit us at www.accenture.com
We are:
Solutions.AI is Accenture's collection of AI solutions that are designed to unlock new efficiencies and growth, enable new ways of working, and facilitate game-changing innovation–3x faster than the typical product lifecycle. Built and delivered on the foundation of Accenture's unparalleled AI expertise, data services, IP and ecosystem partners, our scalable, modular solutions minimize time to market and maximize business impact. The next AI revolution will be built by people like you. Visit us here to find out more about Solutions.AI.",4.1,$10+ billion (USD),Business Services,10000+ Employees,Consulting,Company - Public,"Chesterfield, MO"
153,$14 - $16 Per Hour(Employer est.),1863,Facebook,"Research Scientist, Optimization Research (Core Data Science - PhD)","Accenture is a global professional services company with leading capabilities in digital, cloud and security. Combining unmatched experience and specialized skills across more than 40 industries, we offer Strategy and Consulting, Interactive, Technology and Operations services—all powered by the world’s largest network of Advanced Technology and Intelligent Operations centers. Our 514,000 people deliver on the promise of technology and human ingenuity every day, serving clients in more than 120 countries. We embrace the power of change to create value and shared success for our clients, people, shareholders, partners and communities. Visit us at www.accenture.com
We are:
Solutions.AI is Accenture's collection of AI solutions that are designed to unlock new efficiencies and growth, enable new ways of working, and facilitate game-changing innovation–3x faster than the typical product lifecycle. Built and delivered on the foundation of Accenture's unparalleled AI expertise, data services, IP and ecosystem partners, our scalable, modular solutions minimize time to market and maximize business impact. The next AI revolution will be built by people like you. Visit us here to find out more about Solutions.AI.",4.1,$10+ billion (USD),Biotech & Pharmaceuticals,10000+ Employees,Biotech & Pharmaceuticals,Company - Private,"Menlo Park, CA"
154,$14 - $16 Per Hour(Employer est.),1863,Bayer,Data Science Co-Op,"Bayer is a global enterprise with core competencies in the Life Science fields of health care and agriculture. Its products and services are designed to benefit people and improve their quality of life. At Bayer you have the opportunity to be part of a culture where we value the passion of our employees to innovate and give them the power to change.


Precision Genomics Data Science Co-Op",4.1,$10+ billion (USD),Biotech & Pharmaceuticals,10000+ Employees,Biotech & Pharmaceuticals,Company - Private,"Chesterfield, MO"
155,$14 - $16 Per Hour(Employer est.),2004,Novartis,Data Scientist (Machine Learning),"We are looking for Research Scientists with an Operations Research background to join the Core Data Science team. Core Data Science is an interdisciplinary team of quantitative scientists that aims to deliver research and innovation that fundamentally increase the magnitude of Facebook's successes. The ideal candidate will have extensive graduate training in Operations Research methods, and an interest in answering challenging, open-ended research questions with real-world impact. Expertise in one or more of the following fields is preferred: linear programming, non-linear programming, queueing systems, game theory, operations management, and stochastic modeling.
Answer important product and business questions, by applying appropriate Operations Research methods.
Identify new areas across the family of Facebook apps and products, where Operations Research methods can drive product improvements.
Synthesize and apply relevant insights from the academic literature on Operations Research to Facebook’s products.",4.4,$10+ billion (USD),Biotech & Pharmaceuticals,10000+ Employees,Internet,Company - Public,"Cambridge, MA"
156,$14 - $16 Per Hour(Employer est.),1998,PayPal,Data Scientist 1,"6,000 people dedicated to discovery - 6 research campuses across the globe. As a Data Scientist you will be a part of this great community working to enable the next breakthrough in innovative medicines for patients in need. You will be at the forefront of life sciences, tackling some incredible challenges that are curing diseases and improving patients’ lives.

As a member of the Data Science – Machine Learning team, you will explore and develop machine learning and other advanced analysis approaches to drive drug discovery towards novel innovative medicines. Together with wet-lab scientists and other computational colleagues, you will identify tractable machine learning problems in all stages of drug discovery from disease biology mechanistic understanding, to therapeutic target identification, assay development, safety, and patient stratification. In your role, you will work with drug discovery teams from many different disease areas as part of a large community of hundreds of data scientists in NIBR and Novartis.

You will frame key questions, define appropriate data sets, perform data analysis, or train machine learning models to ultimately address key scientific needs for projects. You will collaborate closely with bench scientists, software engineers, statisticians and bioinformaticians to make sense of high-dimensional pre-clinical and clinical data. This will require you to deploy cutting-edge data science techniques on a wide variety of different data types in order to enable drug discovery teams to succeed. As a successful candidate, you must demonstrate the ability to work cross-functionally, to communicate well, and to deliver impactful results.",,$10+ billion (USD),Information Technology,10000+ Employees,Internet,Company - Public,"San Jose, CA"
157,$14 - $16 Per Hour(Employer est.),1998,Accenture,Behavioral Data Science Manager,"Who we are: Fueled by a fundamental belief that having access to financial services creates opportunity, PayPal (NASDAQ: PYPL) is committed to democratizing financial services and empowering people and businesses to join and thrive in the global economy. Our open digital payments platform gives PayPal’s 392 million active account holders the confidence to connect and transact in new and powerful ways, whether they are online, on a mobile device, in an app, or in person. Through a combination of technological innovation and strategic partnerships, PayPal creates better ways to manage and move money, and offers choice and flexibility when sending payments, paying or getting paid. Available in more than 200 markets around the world, the PayPal platform, including Braintree, Venmo and Xoom enables consumers and merchants to receive money in more than 100 currencies, withdraw funds in 56 currencies and hold balances in their PayPal accounts in 25 currencies.
Job Description Summary: Simility, a PayPal Service, is an end-to-end fraud management platform helping large merchants, banks, and other Fortune 1000 companies manage fraud and risk. Our systems help enterprises detect fraudulent events real time and help protect these enterprises from online threats. We do so by creatively harnessing the power of data, machine learning and humans and be on the cutting edge of fraud detection techniques and algorithms. Simility welcomes big thinkers and passionate team players, who are ready to take their career to the next level.",4.1,$10+ billion (USD),Information Technology,10000+ Employees,Internet,Company - Public,"Cleveland, OH"
158,$14 - $16 Per Hour(Employer est.),1998,Argonne National Laboratory,Data Scientist - Life Sciences,"Who we are: Fueled by a fundamental belief that having access to financial services creates opportunity, PayPal (NASDAQ: PYPL) is committed to democratizing financial services and empowering people and businesses to join and thrive in the global economy. Our open digital payments platform gives PayPal’s 392 million active account holders the confidence to connect and transact in new and powerful ways, whether they are online, on a mobile device, in an app, or in person. Through a combination of technological innovation and strategic partnerships, PayPal creates better ways to manage and move money, and offers choice and flexibility when sending payments, paying or getting paid. Available in more than 200 markets around the world, the PayPal platform, including Braintree, Venmo and Xoom enables consumers and merchants to receive money in more than 100 currencies, withdraw funds in 56 currencies and hold balances in their PayPal accounts in 25 currencies.
Job Description Summary: Simility, a PayPal Service, is an end-to-end fraud management platform helping large merchants, banks, and other Fortune 1000 companies manage fraud and risk. Our systems help enterprises detect fraudulent events real time and help protect these enterprises from online threats. We do so by creatively harnessing the power of data, machine learning and humans and be on the cutting edge of fraud detection techniques and algorithms. Simility welcomes big thinkers and passionate team players, who are ready to take their career to the next level.",4.1,Unknown / Non-Applicable,Government,10000+ Employees,Federal Agencies,Company - Public,"Chicago, IL"
159,$14 - $16 Per Hour(Employer est.),Government,Atlanta Regional Commission,Data Visualization Assistant – PT Temp,"In this exciting area of research, you will be applying machine learning techniques to problems in the life sciences with an emphasis on using computational approaches for detecting patterns in a variety of contexts including cancer, brain injury, infectious disease and microbial community datasets. Problems typically involve the construction of computational models for phenotype prediction from data that includes genomic data and other omics data. This role will develop and apply computational models on new experimental data, provide measures of uncertainty, and participate in interdisciplinary discussions aimed at the design of new experiments. You will report on results of research including publishing scholarly papers in scientific journals, give presentations at symposia, conferences, meetings, and seminars. You will also participate in the preparation of reports and proposals required by funding agencies to obtain and continue funding support.
We are seeking outstanding people to join us in the Data Science and Learning Division and the Bioscience Division at all career levels. As a multidisciplinary national laboratory, Argonne offers an exciting campus atmosphere in which to collaborate on interdisciplinary projects developing solutions to complex scientific and engineering problems on the world’s largest parallel supercomputers.
Research Development (RD)
Biology 1
Long-Term (Fixed Term)
Full time",3.9,,Unknown / Non-Applicable,51 to 200 Employees,Government,State & Regional Agencies,"Atlanta Central City Post Offi, GA"
160,$14 - $16 Per Hour(Employer est.),Government,Microsoft,Data & Applied Scientist,"Center
Center for Livable Communities

Group
Research & Analytics

Salary Range
$15.00-$17.00




POSITION SUMMARY:",3.9,$10+ billion (USD),Unknown / Non-Applicable,51 to 200 Employees,Government,State & Regional Agencies,"Bellevue, WA"
161,$14 - $16 Per Hour(Employer est.),1975,Envision,Data Scientist,"Are you looking for an opportunity to solve business-critical problems for Fortune-500 customers globally using cutting-edge AI and ML technology? Do you enjoy tackling technical challenges and producing innovative solutions to real-world problems? Then come join the AI Platform team in Microsoft. You will be working along the best AI/ML engineering, science, and product talent in the industry and engaging with the largest, most complex customers and ISVs in the world.
Artificial Intelligence (AI) and Machine Learning (ML) is the next explosive growth area in technology relevant to every business in every industry on the planet. The data economy is already booming, and in 2021 there will be a projected 35 zettabytes of data generated by 50 billion connected devices. From these mountains of data, AI and ML will harvest valuable predictive signals and patterns that will fundamentally transform the face of business. With our own already existing volumes of data and research assets, Microsoft is investing to be a key player and a market leader in this industry.

The AI Platform organization at Microsoft has the charter to bring the best of our AI & Research assets, tools and cloud infrastructure, rich data, and trusted position together, to deliver AI and ML services and solutions to customers. The mission of the AI Commercial Engineering team within the AI Platform Product Management organization is to co-innovate, incubate, and improve our core AI platform from scenarios utilizing Azure Cognitive Services and Azure ML. We do so by building and infusing AI technologies in real world solutions and extending the signals from real world patterns to building robust, scalable AI platform services and products. To achieve this, we are co-innovating AI and ML powered solutions (rich APIs, ML models and end to end services) with our strategic ISVs and Enterprise customers, leveraging many other Azure technologies, including Azure Data Analytics (Synapse, ADF, SQL and ADB) and Python/C# microservices, Azure Functions and AKS.",4.4,$10+ billion (USD),Information Technology,10000+ Employees,Computer Hardware & Software,Company - Public,"Saint Louis, MO"
162,$14 - $16 Per Hour(Employer est.),1975,Camgian,Junior Data Scientist,"Are you looking for an opportunity to solve business-critical problems for Fortune-500 customers globally using cutting-edge AI and ML technology? Do you enjoy tackling technical challenges and producing innovative solutions to real-world problems? Then come join the AI Platform team in Microsoft. You will be working along the best AI/ML engineering, science, and product talent in the industry and engaging with the largest, most complex customers and ISVs in the world.
Artificial Intelligence (AI) and Machine Learning (ML) is the next explosive growth area in technology relevant to every business in every industry on the planet. The data economy is already booming, and in 2021 there will be a projected 35 zettabytes of data generated by 50 billion connected devices. From these mountains of data, AI and ML will harvest valuable predictive signals and patterns that will fundamentally transform the face of business. With our own already existing volumes of data and research assets, Microsoft is investing to be a key player and a market leader in this industry.

The AI Platform organization at Microsoft has the charter to bring the best of our AI & Research assets, tools and cloud infrastructure, rich data, and trusted position together, to deliver AI and ML services and solutions to customers. The mission of the AI Commercial Engineering team within the AI Platform Product Management organization is to co-innovate, incubate, and improve our core AI platform from scenarios utilizing Azure Cognitive Services and Azure ML. We do so by building and infusing AI technologies in real world solutions and extending the signals from real world patterns to building robust, scalable AI platform services and products. To achieve this, we are co-innovating AI and ML powered solutions (rich APIs, ML models and end to end services) with our strategic ISVs and Enterprise customers, leveraging many other Azure technologies, including Azure Data Analytics (Synapse, ADF, SQL and ADB) and Python/C# microservices, Azure Functions and AKS.",4.4,$10+ billion (USD),Information Technology,10000+ Employees,Computer Hardware & Software,Company - Public,Indiana
163,$14 - $16 Per Hour(Employer est.),Company - Private,Accenture,Federal - Data Visualization Specialist,"Camgian is hiring a Junior Data Scientist to apply statistical theory and methods to collect, interpret, and summarize data as well as make predictions and recommended actions based on data. As a Junior Data Scientist, you will work with product managers and business stakeholders to gather and analyze large sets of structured and unstructured data in order to gain insights and drive decision making.
Duties/Responsibilities
Participates in data discover to detect patterns and outliers in customer data
Builds predictive models and machine-learning algorithms
Proposes solutions and strategies to business challenges
Presents information using data visualization techniques
Documents all processes and research",4.8,,$5 to $10 million (USD),1 to 50 Employees,Information Technology,Computer Hardware & Software,"Arlington, VA"
164,$14 - $16 Per Hour(Employer est.),2004,Facebook,"Data Scientist, Analytics (University Grad)","Basic Qualifications:
Masters Degree in Statistics, Biostatistics, Data Science, Applied Mathematics, or another highly quantitative discipline;

Strong Python coding skills for data management, visualization, and basic modeling (strong experience and knowledge with standard data science packages such as numpy, pandas, matplotlib, seaborn, sklearn)

Demonstrated knowledge and experience manipulating and analyzing various data sets

Strong Statistical, machine learning and deep learning modeling experience

Strong analytical and quantitative problem solving ability, with demonstrated ability to build, test, and iterate on a variety of model forms

Fast learner and follows project instructions

Strong communication skills and the ability to work with diverse cross-functional teams


Proven experience with good coding practices such as version control, code documentation, automated testing, and code review

Experience working with agriculture or soybean crop data

Experience working with crop disease management or crop protection

Experience in SQL, PySpark, or SparklyR/Spark

Ability to translate complex technical concepts to collaborations, decision makers, and non-technical audiences",,$10+ billion (USD),Business Services,,Consulting,Company - Public,"Seattle, WA"
165,$14 - $16 Per Hour(Employer est.),1989,Universal Business Solutions,Data Scientist/Machine Learning Engineer,"Organization: Accenture Federal Services
Location: Washington, DC
We are:
Accenture Federal Services, helping our federal clients tackle their toughest challenges while unleashing their fullest potential…and then some. What makes our approach so unique? Operating from the nation’s capital, we bring together commercial innovation and leading-edge technologies to deliver an integrated and interactive experience that far exceeds expectations. How? Our passion meets purpose! Through our diverse culture and inclusive thinking, we embrace our employees' ideas taking them from concept to practical solutions. Not to mention, we sleep well at night knowing our work directly impacts and improves the way the world works. We keep our tech smarts sharp by providing abundant training and certification opportunities. Are you ready to learn and grow in a career, while making a difference?",4.1,$10+ billion (USD),Business Services,10000+ Employees,Consulting,Company - Public,"Atlanta Central City Post Offi, GA"
166,$14 - $16 Per Hour(Employer est.),2016,Inari Agriculture,Crop Data Scientist,"Data Scientist / Machine Learning Scientist
(Machine Learning)
Atlanta, GA
Type: 2 Year Plus Contract
Rate: DOE
Who our client is:
· The AI and Data Science team is centralized across the entire organization.
· They work with various product teams across various business units to define high-impact business problems, solve them using novel techniques, and execute and monitor them throughout their lifecycle.",4.3,,Unknown / Non-Applicable,51 to 200 Employees,Biotech & Pharmaceuticals,Company - Private,"West Lafayette, IN"
167,$14 - $16 Per Hour(Employer est.),Company - Private,Aurora,Data Analyst,"About The Role...
We are looking for an experienced Crop Data Scientist to expand our biological data analyses and computational capabilities within the Late Product Development and Crop Science team. Crop Data Scientists collaborate with breeding and sales to analyze data that aligns product offering, placement, and education with commercial objectives. The role reports to the Crop Science Director in West Lafayette, IN.
As a Crop Data Scientist, you will…
Aggregate disparate data formats from diverse sources
Statistically analyze data for quality control and validate hypotheses of relationships between plant genetics, field results, and environment consistent with company data science norms.
Interpret field data / trial results and generate reports or data visualizations",4.1,,Unknown / Non-Applicable,201 to 500 Employees,Information Technology,IT Services,"Mountain View, CA"
168,$14 - $16 Per Hour(Employer est.),Company - Private,S&P Global,Data Scientist,"Who We Are
At Aurora, we’re on a mission to deliver the benefits of self-driving technology safely, quickly, and broadly. It all starts with the Aurora Driver, a platform created from industry-leading hardware and software and designed to adapt across a variety of vehicle types and industries.
We’re led by a team of self-driving luminaries, and we’ve forged strategic partnerships with leading transportation companies—including ride-hailing network Uber, truck-manufacturers PACCAR and Volvo Trucks, and the world’s largest automaker Toyota—setting us up to deliver the Aurora Driver in both trucks and passenger vehicles. We are funded by Amazon, Uber, T Rowe Price, and some of Silicon Valley’s best venture capital firms, including Sequoia, Greylock, and Index Ventures.
Aurora is in the best position to lead the self-driving space with a team of unparalleled depth and expertise, the technology to deliver, and the partnerships to build a transformative business for the long-term.",4.1,,Unknown / Non-Applicable,201 to 500 Employees,Information Technology,IT Services,"Absarokee, MT"
